{
  "eventType": "resume.parse.completed",
  "eventVersion": 1,
  "eventId": "81111111-1111-4111-8111-111111111111",
  "occurredAt": "2026-01-01T00:01:00Z",
  "correlationId": "22222222-2222-4222-8222-222222222222",
  "organizationId": "33333333-3333-4333-8333-333333333333",
  "parsingJobId": "44444444-4444-4444-8444-444444444444",
  "resumeId": "55555555-5555-4555-8555-555555555555",
  "sourceVersionId": "66666666-6666-4666-8666-666666666666",
  "resultArtifact": {
    "bucket": "roliq-resumes-test",
    "objectKey": "parsed/33333333/result.json",
    "checksumSha256": "bbbbbbbbbbbbbbbbbbbbbbbbbbbbbbbbbbbbbbbbbbbbbbbbbbbbbbbbbbbbbbbb",
    "sizeBytes": 8192,
    "contentType": "application/json"
  },
  "extractionArtifact": {
    "bucket": "roliq-resumes-test",
    "objectKey": "extracted/33333333/text.json",
    "checksumSha256": "cccccccccccccccccccccccccccccccccccccccccccccccccccccccccccccccc",
    "sizeBytes": 6144,
    "contentType": "application/json"
  },
  "outputSchemaVersion": "resume-document.v1",
  "attempt": 1
}
